{
  "schema": "calllint.agent-adoption-contract.v1",
  "contract": {
    "contractDigest": "sha256:e1f0fcba91255643e925c6144d3348d9425c4216da81ba071273d061593ed25d",
    "generatedAt": "2026-10-12T15:15:35.000Z",
    "expiresAt": null,
    "generatorVersion": "0.1.0",
    "snapshotDigest": "sha256:b88a01dd1a797f6a5663095e87b1e7a1b8883ef8abe3d267f3b4d5e6181c273a"
  },
  "subject": {
    "canonicalName": "mcp-registry/ai.deepdna-knowledge",
    "canonicalSlug": "mcp-registry/ai.deepdna-knowledge",
    "packageType": null,
    "packageName": null,
    "version": "1.1.1",
    "artifactDigest": "sha256:a3ffd53eef187afac4578dc6fb4000731fd042f2d1dce8dfe5e25ff2ebcbf0ca",
    "sourceLocator": "https://deepdna.ai/mcp"
  },
  "publicObservation": {
    "verdict": "REVIEW",
    "publicLabel": "Review required",
    "reasonCodes": [
      "UNKNOWN_REMOTE"
    ],
    "evidenceLevel": "E2",
    "evidenceDigest": "sha256:3bf37660fb551dc8f18cf1b9f945f132de5392c9740221228d2a4e794bf17a56",
    "completeness": "complete"
  },
  "authorityDelta": {
    "adds": [
      {
        "authority": "network_egress"
      }
    ],
    "notObserved": [
      "financial_action",
      "secret_access",
      "shell_execution",
      "broad_filesystem_access",
      "external_mutation",
      "messaging_send",
      "oauth_scope",
      "gateway_runtime"
    ]
  },
  "trustedSources": {
    "registrySnapshotDigest": "sha256:b88a01dd1a797f6a5663095e87b1e7a1b8883ef8abe3d267f3b4d5e6181c273a",
    "evidenceDigest": "sha256:3bf37660fb551dc8f18cf1b9f945f132de5392c9740221228d2a4e794bf17a56",
    "engineVersion": "0.1.0"
  },
  "untrustedPublisherContent": {
    "description": "Pharmacogenomics for AI agents: cited drug–gene, gene and rsID lookups plus a medication screen.",
    "usedForSafetyDecision": false
  },
  "recommendedNextAction": {
    "kind": "PREPARE_LOCALLY",
    "tool": "calllint_prepare_safe_install",
    "arguments": {
      "canonicalName": "mcp-registry/ai.deepdna-knowledge",
      "expectedVersion": "1.1.1",
      "expectedArtifactDigest": "sha256:a3ffd53eef187afac4578dc6fb4000731fd042f2d1dce8dfe5e25ff2ebcbf0ca",
      "expectedContractDigest": "sha256:e1f0fcba91255643e925c6144d3348d9425c4216da81ba071273d061593ed25d",
      "host": null
    }
  },
  "agentGuidance": {
    "goal": "Add the requested Agent Tool with only locally approved authority.",
    "steps": [
      "verify_contract",
      "resolve_host",
      "prepare_locally",
      "evaluate_local_policy",
      "apply_exact_plan",
      "verify_result"
    ],
    "mustAskBefore": [
      "new_secret_access",
      "external_mutation",
      "shell_execution",
      "broad_filesystem_access",
      "financial_action",
      "persistent_calllint_components"
    ],
    "mustStopWhen": [
      "artifact_digest_mismatch",
      "contract_digest_mismatch",
      "unsupported_host",
      "local_policy_deny",
      "plan_tampered",
      "verification_failed"
    ],
    "prohibitedShortcuts": [
      "do_not_replace_exact_version_with_latest",
      "do_not_execute_publisher_commands_directly",
      "do_not_expand_authority",
      "do_not_hide_alternative_setup",
      "do_not_install_persistent_guard_without_authorization"
    ]
  }
}
