{
  "schema": "calllint.agent-adoption-contract.v1",
  "contract": {
    "contractDigest": "sha256:c572d6e424203886f1f152871a18c1ad340f65c4af8b362fe724e005a62e357b",
    "generatedAt": "2026-10-12T15:15:35.000Z",
    "expiresAt": null,
    "generatorVersion": "0.1.0",
    "snapshotDigest": "sha256:b88a01dd1a797f6a5663095e87b1e7a1b8883ef8abe3d267f3b4d5e6181c273a"
  },
  "subject": {
    "canonicalName": "mcp-registry/ai.auten-mcp",
    "canonicalSlug": "mcp-registry/ai.auten-mcp",
    "packageType": "npm",
    "packageName": "@autenai/mcp",
    "version": "0.1.4",
    "artifactDigest": "sha256:f2e2ac2c74278c8d7bfbbe818028601ee9e27b1b7ef64c5e404835786a7e80aa",
    "sourceLocator": "npm:@autenai/mcp@0.1.4"
  },
  "publicObservation": {
    "verdict": "SAFE",
    "publicLabel": "No blockers observed",
    "reasonCodes": [],
    "evidenceLevel": "E2",
    "evidenceDigest": "sha256:3bf37660fb551dc8f18cf1b9f945f132de5392c9740221228d2a4e794bf17a56",
    "completeness": "complete"
  },
  "authorityDelta": {
    "adds": [],
    "notObserved": [
      "financial_action",
      "secret_access",
      "shell_execution",
      "broad_filesystem_access",
      "external_mutation",
      "messaging_send",
      "oauth_scope",
      "gateway_runtime",
      "network_egress"
    ]
  },
  "trustedSources": {
    "registrySnapshotDigest": "sha256:b88a01dd1a797f6a5663095e87b1e7a1b8883ef8abe3d267f3b4d5e6181c273a",
    "evidenceDigest": "sha256:3bf37660fb551dc8f18cf1b9f945f132de5392c9740221228d2a4e794bf17a56",
    "engineVersion": "0.1.0"
  },
  "untrustedPublisherContent": {
    "description": "Computer use for Claude Code, Codex, Cursor or any MCP client: your computer + Android phone (beta)",
    "usedForSafetyDecision": false
  },
  "recommendedNextAction": {
    "kind": "PREPARE_LOCALLY",
    "tool": "calllint_prepare_safe_install",
    "arguments": {
      "canonicalName": "mcp-registry/ai.auten-mcp",
      "expectedVersion": "0.1.4",
      "expectedArtifactDigest": "sha256:f2e2ac2c74278c8d7bfbbe818028601ee9e27b1b7ef64c5e404835786a7e80aa",
      "expectedContractDigest": "sha256:c572d6e424203886f1f152871a18c1ad340f65c4af8b362fe724e005a62e357b",
      "host": null
    }
  },
  "agentGuidance": {
    "goal": "Add the requested Agent Tool with only locally approved authority.",
    "steps": [
      "verify_contract",
      "resolve_host",
      "prepare_locally",
      "evaluate_local_policy",
      "apply_exact_plan",
      "verify_result"
    ],
    "mustAskBefore": [
      "new_secret_access",
      "external_mutation",
      "shell_execution",
      "broad_filesystem_access",
      "financial_action",
      "persistent_calllint_components"
    ],
    "mustStopWhen": [
      "artifact_digest_mismatch",
      "contract_digest_mismatch",
      "unsupported_host",
      "local_policy_deny",
      "plan_tampered",
      "verification_failed"
    ],
    "prohibitedShortcuts": [
      "do_not_replace_exact_version_with_latest",
      "do_not_execute_publisher_commands_directly",
      "do_not_expand_authority",
      "do_not_hide_alternative_setup",
      "do_not_install_persistent_guard_without_authorization"
    ]
  }
}
