{
  "schema": "calllint.agent-adoption-contract.v1",
  "contract": {
    "contractDigest": "sha256:7ec1ce837797c5385a2716aeca7c21155566ec79240a809836f451a30e16e619",
    "generatedAt": "2026-10-19T13:04:27.000Z",
    "expiresAt": null,
    "generatorVersion": "0.1.0",
    "snapshotDigest": "sha256:0970184e2142d785167786209a8863a689cb018f9bad377d6048a3b7e654bb82"
  },
  "subject": {
    "canonicalName": "mcp-registry/ai.docuguru-docuguru",
    "canonicalSlug": "mcp-registry/ai.docuguru-docuguru",
    "packageType": null,
    "packageName": null,
    "version": "0.4.0",
    "artifactDigest": "sha256:5073f5c117750e5bbd78d1656fdfbe26b34ab2a77a4af10f251590107aae12b4",
    "sourceLocator": "https://mcp.docuguru.ai/mcp"
  },
  "publicObservation": {
    "verdict": "REVIEW",
    "publicLabel": "Review required",
    "reasonCodes": [
      "UNKNOWN_REMOTE"
    ],
    "evidenceLevel": "E2",
    "evidenceDigest": "sha256:b9381aff028bedb776950d19f78c2a50ab9f2002513c9ded5eb3135f5ccd9a7a",
    "completeness": "complete"
  },
  "authorityDelta": {
    "adds": [
      {
        "authority": "network_egress"
      }
    ],
    "notObserved": [
      "financial_action",
      "secret_access",
      "shell_execution",
      "broad_filesystem_access",
      "external_mutation",
      "messaging_send",
      "oauth_scope",
      "gateway_runtime"
    ]
  },
  "trustedSources": {
    "registrySnapshotDigest": "sha256:0970184e2142d785167786209a8863a689cb018f9bad377d6048a3b7e654bb82",
    "evidenceDigest": "sha256:b9381aff028bedb776950d19f78c2a50ab9f2002513c9ded5eb3135f5ccd9a7a",
    "engineVersion": "0.1.0"
  },
  "untrustedPublisherContent": {
    "description": "Journal-formatted PDFs for 18,000+ journals, real DOI citations, posters & slide decks.",
    "usedForSafetyDecision": false
  },
  "recommendedNextAction": {
    "kind": "PREPARE_LOCALLY",
    "tool": "calllint_prepare_safe_install",
    "arguments": {
      "canonicalName": "mcp-registry/ai.docuguru-docuguru",
      "expectedVersion": "0.4.0",
      "expectedArtifactDigest": "sha256:5073f5c117750e5bbd78d1656fdfbe26b34ab2a77a4af10f251590107aae12b4",
      "expectedContractDigest": "sha256:7ec1ce837797c5385a2716aeca7c21155566ec79240a809836f451a30e16e619",
      "host": null
    }
  },
  "agentGuidance": {
    "goal": "Add the requested Agent Tool with only locally approved authority.",
    "steps": [
      "verify_contract",
      "resolve_host",
      "prepare_locally",
      "evaluate_local_policy",
      "apply_exact_plan",
      "verify_result"
    ],
    "mustAskBefore": [
      "new_secret_access",
      "external_mutation",
      "shell_execution",
      "broad_filesystem_access",
      "financial_action",
      "persistent_calllint_components"
    ],
    "mustStopWhen": [
      "artifact_digest_mismatch",
      "contract_digest_mismatch",
      "unsupported_host",
      "local_policy_deny",
      "plan_tampered",
      "verification_failed"
    ],
    "prohibitedShortcuts": [
      "do_not_replace_exact_version_with_latest",
      "do_not_execute_publisher_commands_directly",
      "do_not_expand_authority",
      "do_not_hide_alternative_setup",
      "do_not_install_persistent_guard_without_authorization"
    ]
  }
}
