{
  "schema": "calllint.agent-adoption-contract.v1",
  "contract": {
    "contractDigest": "sha256:4c9d758c6e0f996519793ce95d4153cc07f921a62693abb175eb691e7d370bc0",
    "generatedAt": "2026-10-01T13:14:15.000Z",
    "expiresAt": null,
    "generatorVersion": "0.1.0",
    "snapshotDigest": "sha256:26a209215bb97288026afdb4dece5351321c366cc68223883b57099d98850ceb"
  },
  "subject": {
    "canonicalName": "mcp-registry/ai.fincontext-fincontext",
    "canonicalSlug": "mcp-registry/ai.fincontext-fincontext",
    "packageType": null,
    "packageName": null,
    "version": "1.0.0",
    "artifactDigest": "sha256:dff69beca6202f3172de230f1ab5bcfaaf8707f85a069da42d3b4a35d210680e",
    "sourceLocator": "https://fincontext.ai/mcp"
  },
  "publicObservation": {
    "verdict": "REVIEW",
    "publicLabel": "Review required",
    "reasonCodes": [
      "UNKNOWN_REMOTE"
    ],
    "evidenceLevel": "E2",
    "evidenceDigest": "sha256:9797bce65b13fc45350ff64e384f9244db5c419799e4d7975fdd5365d0b39873",
    "completeness": "complete"
  },
  "authorityDelta": {
    "adds": [
      {
        "authority": "network_egress"
      }
    ],
    "notObserved": [
      "financial_action",
      "secret_access",
      "shell_execution",
      "broad_filesystem_access",
      "external_mutation",
      "messaging_send",
      "oauth_scope",
      "gateway_runtime"
    ]
  },
  "trustedSources": {
    "registrySnapshotDigest": "sha256:26a209215bb97288026afdb4dece5351321c366cc68223883b57099d98850ceb",
    "evidenceDigest": "sha256:9797bce65b13fc45350ff64e384f9244db5c419799e4d7975fdd5365d0b39873",
    "engineVersion": "0.1.0"
  },
  "untrustedPublisherContent": {
    "description": "Read-only bank & investment accounts via Plaid: balances, holdings, transactions, SQL analytics.",
    "usedForSafetyDecision": false
  },
  "recommendedNextAction": {
    "kind": "PREPARE_LOCALLY",
    "tool": "calllint_prepare_safe_install",
    "arguments": {
      "canonicalName": "mcp-registry/ai.fincontext-fincontext",
      "expectedVersion": "1.0.0",
      "expectedArtifactDigest": "sha256:dff69beca6202f3172de230f1ab5bcfaaf8707f85a069da42d3b4a35d210680e",
      "expectedContractDigest": "sha256:4c9d758c6e0f996519793ce95d4153cc07f921a62693abb175eb691e7d370bc0",
      "host": null
    }
  },
  "agentGuidance": {
    "goal": "Add the requested Agent Tool with only locally approved authority.",
    "steps": [
      "verify_contract",
      "resolve_host",
      "prepare_locally",
      "evaluate_local_policy",
      "apply_exact_plan",
      "verify_result"
    ],
    "mustAskBefore": [
      "new_secret_access",
      "external_mutation",
      "shell_execution",
      "broad_filesystem_access",
      "financial_action",
      "persistent_calllint_components"
    ],
    "mustStopWhen": [
      "artifact_digest_mismatch",
      "contract_digest_mismatch",
      "unsupported_host",
      "local_policy_deny",
      "plan_tampered",
      "verification_failed"
    ],
    "prohibitedShortcuts": [
      "do_not_replace_exact_version_with_latest",
      "do_not_execute_publisher_commands_directly",
      "do_not_expand_authority",
      "do_not_hide_alternative_setup",
      "do_not_install_persistent_guard_without_authorization"
    ]
  }
}
